publication_view.author;publication_view.publication_title;publication_view.publication_year
Richter, D., Hublin, J.-J., Jaubert, J., McPherron, S.J.P., Soressi, M., Texier, J.-P.;Thermoluminescence dates for the Middle Palaeolithic site of Chez-Pinaud Jonzac (France);2013;
Richter, D., Klinger, P., Schmidt, C., van den Bogaard, P., Zöller, L.;New chronometric age estimates for the context of the Neanderthal from Wannen-Ochtendung (Germany) by TL and argon dating;2017;
Richter, D., Krbetschek, M.;Preliminary luminescence dating results for two Middle Palaeolithic occupations at Neumark-Nord 2;2014;
Richter, D., Krbetschek, M.;The age of the Lower Paleolithic occupation at Schöningen;2015;
Richter, D., Moser, J., Nami, M., Eiwanger, J., Mikdad, A.;New chronometric data from Ifri n Ammar (Morocco) and the chronostratigraphy of the Middle Palaeolithic in the Western Maghreb;2010;
Richter, D., Richter, J., Böhner, U., Mauz, B., Weissmüller, W., Wagner, G.A., Freund, G., Rink, W.J.;Luminescence Dating of the Middle/Upper Palaeolithic Sites “Sesselfelsgrotte” and “Abri I am Schulerloch”, Altmühltal, Bavaria;2000;
Richter, J.;Consumption and production: Transformational processes in the upper levels of Kabazi II, Unit VI;2005;
Richter, J.;Die 14C-Daten aus der Sesselfelsgrotte und die Zeitstellung des Micoquien/M.M.O;2002;
Richter, J.;Jungpaläolithische Funde aus Breitenbach/Kr. Zeitz im Germanischen Nationalmuseum Nürnberg;1987;
Richter, J.;Kabazi II, Unit V, Lower Levels: Lithics from the Pocket;2005;
Richter, J.;Sesselfelsgrotte III. Der G-Schichten-Komplex der Sesselfelsgrotte: Zum Verständnis des Micoquien;1997;
Richter, J.;The role of leaf points in the Late Middle Palaeolithic of Germany;2009;
Ricken, W., Grüger, E.;Vegetationsentwicklung, Paläoböden, Seespiegelschwankungen: Untersuchungen an eem- und weichselzeitlichen Sedimenten vom Südrand des Harzes;1988;
Rieder, K.;Der Hohle Stein bei Schambach Neandertaler und Eiszeitjäger in der Altmühlalb;2016;
Rieder, K.;Die Artefakte der pleistozänen Höhlenstratigraphie im Hohlen Stein bei Schambach Lkr. Eichstätt;1989;
Rieder, K.;Kritische Analyse alter Grabungsergebnisse aus dem Hohlen Stein bei Schambach aus der Sicht der Profiluntersuchungen von 1977-1982: Aspekte zur Geschichte der Höhlenverfüllung, ihrer Paläontologie und Archäologie;1992;
Riek, G.;Das Paläolithikum der Brillenhöhle bei Blaubeuren (Schwäbische Alb);1973;
Riek, G.;Die Eiszeitjägerstation am Vogelherd im Lonetal 1: Die Kulturen;1934;
Riek, G.;Ein Beitrag zur Kenntnis des süddeutschen Solutréen;1938;
Riel-Salvatore, J., Gravel-Miguel, C., Maggi, R., Martino, G., Rossi, S., Sparacello, V.S.;New Insight into the Paleolithic Chronology and Funerary Ritual of Cavena delle Arene Candide;2018;
Riel-Salvatore, J., Ludeke, I.C., Negrino, F., Holt, B.M.;A spatial analysis of the late Mousterian levels of Riparo Bombrini (Balzi Rossi, Italy);2013;
Riel-Salvatore, J., Miller, A.E., Clark, G.A.;An empirical evaluation of the case for a Châtelperronian-Aurignacian interstratification at Grotte des Fées de Châtelperron;2008;
Riel-Salvatore, J., Negrino, F.;Human adaptations to climatic change in Liguria across the Middle-Upper Paleolithic transition;2018;
Riel-Salvatore, J., Negrino, F.;Lithic technology, mobility and human niche construction in Early Upper Paleolithic Italy;2018;
Riga, A., Oxilia, G., Panetta, D., Salvadori, P.A., Benazzi, S., Wadley, L., Moggi-Cecchi, J.;Human deciduous teeth from the Middle Stone Age layers of Sibudu Cave (South Africa);2018;
Rigaud, J.-P.;Le Paléolithique en Perigord: Les données sud-ouest sarladais et leurs implications;1982;
Rigaud, J.-P., Simek, J.F., Delpech, F., Texier, J.-P.;L'Aurignacien et le Gravettian du nord de l'Aquitaine: la contribution du Flageolet I (Bézenac, Dordogne, France);2016;
Rigaud, J.-P., Simek, J.F., Ge, T.;Mousterian fires from Grotte XVI (Dordogne, France);1995;
Rigaud, J.-P., Texier, P.-J., Parkington, J., Poggenpoel, C.;Le mobilier Stillbay et Howiesons Poort de l'abri Diepkloof. La chronologie du Middle Stone Age sud-africain et ses implications;2006;
Rigaud, J.P.;Analyse typologique des industries de la Grotte Vaufrey;1988;
Rigaud, S., Roussel, M., Rendu, W., Primault, J., Renou, S., Hublin, -.J., Soressi, M.;Les pratiques ornementales à l'Aurignacien ancien dans le Centre-Ouest de la France: L'apport des fouilles récentes aux Cottés (Vienne);2014;
Rightmire, G.P.;The Evolution of Homo Erectus: Comparative Anatomical Studies of an Extinct Human Species;1993;
Rightmire, G.P.;The Lake Ndutu cranium and early Homo Sapiens in Africa;1983;
Rightmire, G.P., Deacon, H.J.;Comparative studies of Late Pleistocene human remains from Klasies River Mouth, South Africa;1991;
Rightmire, G.P., Deacon, H.J.;New human teeth from Middle Stone Age deposits at Klasies River, South Africa;2001;
Rightmire, G.P., Deacon, H.J., Schwartz, J.H., Tattersall, I.;Human foot bones from Klasies River main site, South Africa;2006;
Rightmire, G.P., Lordkipanidze, D., Vekua, A.;Anatomical descriptions, comparative studies and evolutionary significance of the hominin skulls from Dmanisi, Republic of Georgia;2006;
Rind, M.M., Sandner, R.;Archäologiepark Altmühltal - Ein Reiseführer in die Vorzeit;2008;
Ring, U., Schwartz, H.L., Bromage, T.G., Sanaane, C.;Kinematic and sedimentological evolution of the Manyara Rift in northern Tanzania, East Africa;2005;
Rink, W.I., Schwarcz, H.P., Grün, R., Yalcinkaya, I., Taskiran, H., Otte, M., Valladas, H., Mercier, N., Bar-Yosef, O., Kozlowski, J.;ESR Dating of the Last Interglacial Mousterian at Karain Cave, Southern Turkey;1994;
Rink, W.J., Kandel, A.W., Conard, N.J.;The ESR geochronology and geology of the open-air Palaeolithic deposits in Bollschweil, Germany;2002;
Rink, W.J., Karavanić, I., Pettitt, P.B., van der Plicht, J., Smith, F.H., Bartoll, J.;ESR and AMS-based 14C Dating of Mousterian Levels at Mujina Pećina, Dalmatia, Croatia;2002;
Rink, W.J., Mercier, N., Mihailovic, D., Morley, M.W., Thompson, J.W., Roksandic, M.;New Radiometric Ages for the BH-1 Hominin from Balanica (Serbia): Implications for Understanding the Role of the Balkans in Middle Pleistocene Human Evolution;2013;
Rink, W.J., Richter, D., Schwarcz, H.P., Marks, A.E., Monigal, K., Kaufman, D.;Age of the Middle Palaeolithic Site of Rosh Ein Mor, Central Negev, Israel: Implications for the Age Range of the Early Levantine Mousterian of the Levantine Corridor;2003;
Rink, W.J., Schepartz, L., Miller-Antonio, S., Huang, W., Hou, Y.-M., Bakken, D., Richter, D., LaReau, H.;Electron Spin Resonance (ESR) Dating of Mammalian Tooth Enamel at Panxian Dadong Cave, Guizhou, China;2003;
Rink, W.J., Schwarcz, H.P., Lee, H.K., Cabrera Valdés, V., Bernaldo de Quirós, F., Hoyos, M.;ESR dating of Mousterian levels at El Castillo Cave, Cantabria, Spain;1997;
Rink, W.J., Schwarcz, H.P., Lee, H.K., Rees-Jones, J., Rabinovich, R., Hovers, E.;Electron spin resonance (ESR) and thermal ionization mass spectrometric (TIMS) 230Th/234U dating of teeth in Middle Paleolithic layers at Amud Cave, Israel;2001;
Rink, W.J., Schwarcz, H.P., Lee, H.K., Valdés, V.C., De Quirós, F.B., Hoyos, M.;ESR dating of tooth enamel: comparison with AMS 14 C at El Castillo Cave, Spain;1996;
Rink, W.J., Schwarcz, H.P., Ronen, A., Tsatskin, A.;Confirmation of a near 400 ka age for the Yabrudian industry at Tabun Cave, Israel;2004;
Rink, W.J., Schwarcz, H.P., Smith, F.H., Radovcic, J.;ESR ages for Krapina hominids;1995;
Rink, W.J., Schwarcz, H.P., Valoch, K., Seitl, L., Stringer, C.B.;ESR Dating of Micoquian Industry and Neanderthal Remains at Kůlna Cave, Czech Republic;1996;
Rink, W.J., Schwarcz, H.P., Weiner, S., Goldberg, P., Meignen, L., Bar-Yosef, O.;Age of the Mousterian industry at Hayonim Cave, Northern Israel, using electron spin resonance and 230Th/234U methods;2004;
Rios Garaizar, J.;Características de la producción lítica al final del Paleolítico Medio en el País Vasco: El caso del nivel B de Axlor (Dima, Bizkaia);2005;
Rios Garaizar, J.;Sondeos Arqueológicos en la Cueva de Arlanpe (Lemoa, Bizkaia);2006;
Rios-Garaizar, J., Garate Maidagan, D., Gómez Olivencia, A., Arceredillo Alonso, D., Iriarte Avilés, E., García Moreno, A., Garrido Pimentel, D., San Pedro Calleja, Z.;El final del Solutrense en el Oriente Cantábrico a través de las ocupaciones de la Cueva de Arlanpe (Lemoa, Vizcaya);2013;
Rios-Garaizar, J., Maidagan, D.G., Gómez-Olivencia, A., Iriarte, E., Arceredillo-Alonso, D., Iriarte-Chiapusso, M.J., Garcia-Ibaibarriaga, N., García-Moreno, A., Gutierrez-Zugasti, I., Torres, T., Aranburu, A., Arriolabengoa, M., Bailón, S., Murelaga, X., Ordiales, A., Ortiz, J.E., Rofes, J., San Pedro, Z.;Short-term Neandertal occupations in the late Middle Pleistocene of Arlanpe (Lemoa, northern Iberian Peninsula);2015;
Riquelme Cantal, J.A., García Solano, J.A., Moigne, A.M., Caparrós, M., Botella Ortega, D., Barroso Ruiz, C.;Un yacimiento del pleistoceno medio y superior en el Sur de la Peninsula Iberica: la Cueva del Angel (Lucena, Córdoba);2010;
Rivals, F., Arellano, A.;Les faunes des sites du Pléistocène supérieur du Caucase méridional: Grotte de Sakažhia, Grotte d’Ortvala et Grotte du Bronze (République de Géorgie);2010;
Rivals, F., Blasco, R.;Presence of Hemitragus aff. cedrensis (Mammalia, Bovidae) in the Iberian Peninsula: Biochronological and biogeographical implications of its discovery at Bolomor Cave (Valencia, Spain);2008;
Rizal, Y., Westaway, K.E., Zaim, Y., van den Bergh, G.D., Bettis, E.A., Morwood, M.J., Huffman, O.F., Grün, R., Joannes-Boyau, R., Bailey, R.M., Sidarto, Westaway, M.C., Kurniawan, I., Moore, M.W., Storey, M., Aziz, F., Suminto, Zhao, J.-X., Aswan, Sipola, M.E., Larick, R., Zonneveld, J.-P., Scott, R., Putt, S., Ciochon, R.L.;Last appearance of Homo erectus at Ngandong, Java, 117,000-108,000 years ago;2020;
Robbins, L.H., Brook G.A., Murphy M.L., Downey, W.S.;Late Quaternary archaeological and palaeoenvironmental data from sediments at Rhino Cave, Tsodilo Hills, Botswana;2000;
Robbins, L.H., Brook, G.A., Campbell, A.C., Murphy, M.L.;World's Oldest Ritual Site? The 'Python Cave' at Tsodilo Hills World Heritage Site, Botswana;2007;
Robbins, L.H., Campbell, A.C., Brook, G.A., Murphy, M.L., Hitchcock, R.K.;The Antiquity of the Bow and Arrow in the Kalahari Desert: Bone Points from White Paintings Rock Shelter, Botswana;2012;
Robbins, L.H., Murphy, M.L., Brook, G.A., Ivester, A.H., Campbell, A.C., Klein, R.G., Milo, R.G., Stewart, K.M., Downey, W.S., Stevens, N.J.;Archaeology, Palaeoenvironment, and Chronology of the Tsodilo Hills White Paintings Rock Shelter, Northwest Kalahari Desert, Botswana;2000;
Robbins, L.H., Murphy, M.L., Campbell, A.C., Brook, G.A.;Excavations at the Tsodilo Hills Rhino Cave;1996;
Robbins, L.H., Murphy, M.L., Stewart, K.M., Campbell, A.C., Brook, G.A.;Barbed bone points, paleoenvironment, and the antiquity of fish exploitation in the Kalahari, Botswana;1994;
Roberts, D., Berger, L.R.;Last interglacial (c. 117 kyr) human footprints from South Africa;1997;
Roberts, D.L.;Last Interglacial Hominid and Associated Vertebrate Fossil Trackways in Coastal Eolianites, South Africa;2008;
Roberts, M.B., Parfitt, S.;Boxgrove: A Middle Pleistocene Hominid Site at Eartham Quarry, Boxgrove, West Sussex;1999;
Roberts, M.B., Parfitt, S., Pope, M.I., Wenban-Smith, F.F., Macphail, R.I., Locker, A., Stewart, J.R.;Boxgrove, West Sussex: Rescue Excavations of a Lower Palaeolithic Landsurface (Boxgrove Project B, 1989-91);1997;
Roberts, M.B., Pope, M.I.;The archaeological and sedimentary records from Boxgrove and Slindon;2009;
Robertsson, A.-M.;Reinvestigation of the interglacial pollen flora at Leveäniemi, Swedish;1997;
Robinson, J.T., Mason, R.J.;Australopithecines and Artefacts at Sterkfontein;1962;
Roblin-Jouve, A., Miskovsky, J.-C., Hardy, M., Girard, M., David, F.;Étude stratigraphique, lithologique et sédimentologique de la Grotte du Bison à Arcy-sur-Cure (Yonne)Stratigraphic, lithological and sedimentological study of the Bison Cave in Arcy-sur-Cure (Yonne);2018;
Rocca, R.;Before the transition? The final middle Palaeolithic lithic industry from the Grotte du Renne (layer XI) at Arcy-sur-Cure (Burgundy, France);2017;
Roche, H., Brugal, J.-P., Delagnes, A., Feibel, C., Harmand, S., Kibunjia, M., Prat, S., Texier, P.-J.;Les sites archeologiques plio-pleistocenes de la formation de Nachukui, Ouest-Turkana, Kenya: bilan synthetique;2003;
Roche, H., Brugal, J.-P., Lefevre, D., Ploux, S., Texier, P.-J.;Isenya: état des recherches sur un nouveau site acheuléen d'Afrique orientale;1988;
Roche, H., Delagnes, A., Brugal, J.P., Feibel, C., Kibunjia, M., Mourre, V., Texier, P.J.;Early hominid stone tool production and technical skill 2.34 Myr ago in West Turkana, Kenya;1999;
Roche, H., de la Torre, I., Arroyo, A., Brugal, J.-P., Harmand, S.;Naiyena Engol 2 (West Turkana, Kenya): A Case Study on Variability in the Oldowan;2018;
Roche, J.;Chronostratigraphie des restes atériens de la Grotte des Contrebandiers à Témara (Province de Rabat);1976;
Roche, J.;L'Atérien de la grotte de Taforalt (Maroc oriental);1967;
Roche, J.;La grotte de Tarofalt;1953;
Roche, J.;La grotte du Placard;1965;
Roche, J.;Le Paléolithique supérieur portugais. Bilan de nos connaissances et problèmes;1964;
Roche, J.;État actuel de nos connaissances sur le Solutréen portugais;1974;
Rodriguez-Vidal, J., Cáceres, L.M., Finlayson, J.C., Gracia, F.J., Martinez-Aguirre, A.;Neotectonics and shoreline history of the Rock of Gibraltar, southern Iberia;2004;
Rodríguez Asensio, J.A.;The Early Paleolithic site of Banugues (Gozon, Asturias, Spain);1978;
Rodríguez, J., Burjachs, F., Cuenca-Bescós, G., García, N., Van der Made, J., Pérez González, A., Blain, H.A., Expósito, I., López-García, J.M., García Antón, M., Allué, E., Cáceres, I., Huguet, R., Mosquera, M., Ollé, A., Rosell, J., Parés, J.M., Rodríguez, X.P., Díez, C., Rofes, J., Sala, R., Saladié, P., Vallverdú, J., Bennasar, M.L., Blasco, R., Bermúdez de Castro, J.M., Carbonell, E.;One million years of cultural evolution in a stable environment at Atapuerca (Burgos, Spain);2011;
Roe, D.A.;A Gazetteer of British Lower and Middle Palaeolithic sites;1968;
Roebroeks, W.;Archaeological research at the Maastricht-Belvédère pit: a review;1985;
Roebroeks, W.;From find scatters to early hominid behaviour. A study of Middle Palaeolithic riverside settlements at Maastricht-Belvédère (The Netherlands);1988;
Roebroeks, W., Kolen, J., van Poecke, M., van Gijn, A.;'Site J': An early Weichselian (Middle Palaeolithic) flint scatter at Maastricht-Belvédère, The Netherlands;1994;
Roebroeks, W., de Loecker, D., Hennekens, P., van Ieperen, M.;A veil of stones: on the interpretation of an early Middle Palaeolithic low density scatter at Maastricht-Belvédère (The Netherlands);1992;
Rofes, J., Garcia-Ibaibarriaga, N., Murelaga, X., Arrizabalaga, Á., Iriarte, M.-J., Cuenca-Bescós, G., Villaluenga, A.;The southwesternmost record of Sicista (Mammalia; Dipodidae) in Eurasia, with a review of the palaeogeography and palaeoecology of the genus in Europe;2012;
Roksandic, M., Mihailović, D., Mercier, N., Dimitrijević, V., Morley, M.W., Rakočević, Z., Mihailović, B., Guibert, P., Babb, J.;A human mandible (BH-1) from the Pleistocene deposits of Mala Balanica cave (Sićevo Gorge, Niš, Serbia);2011;
Romagnoli, F.;A second life: Recycling production waste during the Middle Palaeolithic in layer L at Grotta del Cavallo (Lecce, Southeast Italy);2015;
Romagnoli, F., Martini, F., Sarti, L.;Neanderthal Use of Callista chione Shells as Raw Material for Retouched Tools in South-east Italy: Analysis of Grotta del Cavallo Layer L Assemblage with a New Methodology;2015;
Romandini, M., Peresani, M., Laroulandie, V., Metz, L., Pastoors, A., Vaquero, M., Slimak, L.;Convergent Evidence of Eagle Talons Used by Late Neanderthals in Europe: A Further Assessment on Symbolism;2014;
Romandini, M., Terlato, G., Nannini, N., Tagliacozzo, A., Benazzi, S., Peresani, M.;Bears and humans, a Neanderthal tale. Reconstructing uncommon behaviors from zooarchaeological evidence in southern Europe;2018;
Romano, M., Citton, P., Salvador, I., Arobba, D., Rellini, I., Firpo, M., Negrino, F., Zunino, M., Starnini, E., Avanzini, M.;A multidisciplinary approach to a unique Palaeolithic human ichnological record from Italy (Bàsura Cave);2019;
Ron, H., Porat, N., Ronen, A., Tchernov, E., Horwitz, L.K.;Magnetostratigraphy of the Evron Member. Implications for the age of the Middle Acheulian site of Evron Quarry;2003;
Ronchitelli, A., Abbazzi, L., Accorsi, C.A., Bandini Mazzanti, M., Bernardi, M., Masini, F., Mercuri, A., Mezzabotta, C., Rook, L.;Palethnological, Palynological and Paleontological data on the Grotta Grande of Scario - Salerno (Campania, Southern Italy);1998;
Ronchitelli, A., Abbazzi, L., Accorsi, C.A., Mazzanti, M., Bernardi, M., Masini, F., Mercuri, A.M., Mezzabotta, C., Rook, L.;The Grotta Grande of Scario (Salerno - Southern Italy): stratigraphy, archaeological finds, pollen and mammals;1998;
Ronchitelli, A., Boscato, P., Surdi, G., Masini, F., Petruso, D., Accorsi, C.A., Torri, P.;The Grotta Grande of Scario (Salerno, Italy): Archaeology and environment during the last interglacial (MIS 5) of the Mediterranean region;2011;
Ronchitelli, A., Freguglia, M., Boscato, P.;Paléoécologie et stratégies de subsistance al'Abri du Molare de Scario (S. Giovanni a Piro- Salerne-Italie du Sud): niveaux Paléolithique moyen 44-49, données préliminaires;2004;
Ronchitelli, A., Mugnaini, S., Arrighi, S., Atrei, A., Capecchi, G., Giamello, M., Longo, L., Marchettini, N., Viti, C., Moroni, A.;When technology joins symbolic behaviour: The Gravettian burials at Grotta Paglicci (Rignano Garganico - Foggia - Southern Italy);2015;
Ronen, A.;Excavations at the cave of Sefunim (lraq El-Barud), Mt. Carmel preliminary report;1968;
Ronen, A.;The Lower Paleolithic site Evron-Quarry in Western Galilee, Israel;1991;
Ronen, A.;The oldest human groups in the Levant;2006;
Ronen, A., Ben-Tor, A., Büller, J., Farrand, W.R., Inbar, M., Klein, M., Lamdan, M., Naveh, Z., Tchernov, E.;Sefunim Prehistoric Sites. Mount Carmel, Israel;1984;
Ronen, A., Burdukiewicz, J.-M., Laukhin, St.A., Winter, Y., Tsatskin, A., Dayan, T., Kulikov, O.A., Vlasov, V.K., Semenov, V.V.;The Lower Paleolithic site Bizat Ruhama in the Northern Negev, Israel;1998;
Ronen, A., Davies, M.;Tirat-Carmel: A Mousterian Open-Air Site in Israel;1974;
Ronen, A., Gilead, D., Bruder, G., Meller, P.;Notes on the Pleistocene Geology and Prehistory of the Central Disbon Valley, Upper Galilee, Israel;1974;
Ronen, A., Vandermeersch, B.;The Upper Palaeolithic sequence in the cave of Qafza (Israel);1972;
Rosas, A.;A gradient of size and shape for the Atapuerca sample and Middle Pleistocene hominid variability;1997;
Rosas, A., Bastir, M.;Geometric morphometric analysis of allometric variation in the mandibular morphology of the hominids of Atapuerca, Sima de los Huesos site;2004;
Rosas, A., Estalrrich, A., García-Vargas, S., García-Tabernero, A., Huguet, R., Lalueza-Fox, C., de la Rasilla, M.;Identification of Neandertal individuals in fragmentary fossil assemblages by means of tooth associations: The case of El Sidrón (Asturias, Spain);2013;
Rosas, A., Huguet, R., Pérez-González, A., Carbonell, E., Bermúdez de Castro, J.M., Vallverdú, J., van der Made, J., Allué, E., García, N., Martínez-Pérez, R., Rodríguez, J., Sala, R., Saladie, P., Benito, A., Martínez-Maza, C., Bastir, M.;The "Sima del Elefante" cave site at Atapuerca (Spain);2006;
Rosas, A., Martinez-Maza, C.;Bone remodeling of the Homo heidelbergensis mandible: the Atapuerca-SH sample;2010;
Rosell, J., Blasco, R., Peris, J.F., Carbonell, E., Barkai, R., Gopher, A.;Recycling bones in the Middle Pleistocene: Some reflections from Gran Dolina TD10-1 (Spain), Bolomor Cave (Spain) and Qesem Cave (Israel);2015;
Rosendahl, G.;Die oberen Schichten von La Micoque (Dordogne, Frankreich);2004;
Rosendahl, W., Maureille, B., Trinkaus, E.;Rediscovery of the Badegoule 5 skeletal remains (Badegoule, Le Lardin-Saint-Lazare, Dordogne, France);1994;
Rosendahl, W., Wiegand, B., Kaulich, B., Reisch, L.;Zur Altersstellung der mittelpaläolithischen Höhlenfundstelle Hunas, Ldkr. Nürnberger Land: Ergebnisse und Interpretationen alter und neuer Sinterdatierungen;2006;
Roset, J.-P., Harbi-Riahi, M.;El Akarit: un site archéologique du Paléolithique moyen dans le sud de la Tunisie;2007;
Rosso, D.E., d'Errico, F., Zilhão, J.;Stratigraphic and spatial distribution of ochre and ochre processing tools at Porc-Epic Cave, Dire Dawa, Ethiopia;2014;
Roth, B.J., Dibble, H.L.;Production and Transport of Blanks and Tools at the French Middle Paleolithic Site of Combe-Capelle Bas;1998;
Roth, B.J., Dibble, H.L., Lenoir, M.;Basic Descriptions of the Lithic Assemblages;1995;
Rots, V.;Insights into early Middle Palaeolithic tool use and hafting in Western Europe. The functional analysis of level IIa of the early Middle Palaeolithic site of Biache-Saint-Vaast (France);2013;
Rots, V.;The functional analysis of the Mousterian and Micoquian assemblages of Sesselfelsgrotte, Germany. Tool use and Hafting in the European Late Middle Paleolithic;2009;
Rots, V., Coppe, J., Conard, N.J.;A Leaf Point Documents Hunting with Spears in the Middle Paleolithic at Hohle Fels, Germany;2021;
Rots, V., Hardy, B.L., Serangeli, J., Conard, N.J.;Residue and microwear analyses of the stone artifacts from Schöningen;2015;
Rots, V., Van Peer, P.;Early evidence of complexity in lithic economy: core-axe production, hafting and use at Late Middle Pleistocene site 8-B-11, Sai Island (Sudan);2006;
Rougier, H.;Étude descriptive et comparative de Biache-Saint-Vaast 1 (Biache-Saint-Vaast, Pas-de-Calais, France);2003;
Rougier, H., Crevecoeur, I., Beauval, C., Posth, C., Flas, D., Wißing, C., Furtwängler, A., Germonpré, M., Gómez-Olivencia, A., Semal, P., van der Plicht, J., Bocherens, H., Krause, J.;Neandertal cannibalism and Neandertal bones used as tools in Northern Europe;2016;
Rougier, H., Crevecoeur, I., Fiers, E., Hauzeur, A., Germonpré, M., Mareille, B., Semal, P.;Collections de la Grotte de Spy: (re)découvertes et inventaire anthropologique;2004;
Rougier, H., Crevecoeur, I., Semal, P., Toussaint, M.;Des Néanderthaliens dans la Troisième Caverne de Goyet;2009;
Rousseau, D.-D., Zöller, L., Valet, J.-P.;Late Pleistocene Climatic Variations at Achenheim, France, Based on a Magnetic Susceptibility and TL Chronology of Loess;1998;
Roussel, M., Soressi, M.;La Grande Roche de la Plématrie à Quincay (Vienne). L'evolution du Châtelperronien revisitée;2010;
Roussel, M., Soressi, M.;Une nouvelle séquence du Paléolithique supérieur ancien aux marges sud-ouest du Bassin parisien: Les Cottés dans la Vienne;2013;
Rowlett, R.M.;Fire control by Homo erectus in East Africa and Asia;2000;
Royer, A.;Intérêts de l’utilisation des décapages lors des fouilles archéologiques pour l’étude des restes de petits vertébrés;2014;
Royer, A., Lécuyer, C., Montuire, S., Escarguel, G., Fourel, F., Mann, A., Maureille, B.;Late Pleistocene (MIS 3-4) climate inferred from micromammal communities and δ18O of rodents from Les Pradelles, France;2013;
Rubini, M., Cerroni, V., Festa, G., Sardella, R., Zaio, P.;A revision of hominin fossil teeth from Fontana Ranuccio (Middle Pleistocene, Anagni, Frosinone, Italy);2014;
Rudaya, N.;Environmental conditions during the early human settlement of Chagyrskaya Cave (Altai);2013;
Rudaya, N., Vasiliev, S., Viola, B., Talamo, S., Markin, S.;Palaeoenvironments during the period of the Neanderthals settlement in Chagyrskaya cave (Altai Mountains, Russia);2017;
Rudinskii, M.Y.;Pushkari;1947;
Ruff, C.;Body size and body shape in early hominins - implications of the Gona Pelvis;2010;
Rufo, M.A., Minelli, A., Peretto, C.;L'industrie en calcaire du site Paléolithique d'Isernia la Pineta : un modèle interprétatif de stratégie comportementale;2009;
Ruhlmann, A.;La grotte préhistorique de Dar ès-Soltan;1951;
Ruhlmann, A.;Les grottes préhistoriques d'el Khenzira;1936;
Ruiter, D.J., de Brophy, J.K., Lewis, P.J., Churchill, S.E., Berger, L.R.;Faunal assemblage composition and paleoenvironment of Plovers Lake, a Middle Stone Age locality in Gauteng Province, South Africa;2008;
Ruiu, F., Fiore, I., Tagliacozzo, A.;La fauna del sito gravettiano di Roccia San Sebastiano (Mondragone, Casertta);2010;
Runnels, C., Korkuti, M., Galaty, M.L., Timpson, M.E., Whittaker, J.C., Stocker, S.R., Davis, J.K., Bejko, L., Mucaj, S.;The Palaeolithic and Mesolithic of Albania: Survey and Excavation at the Site of Kryegjata B (Fier District);2004;
Runnels, C., Van Andel, T.H.;A handaxe from Kokkinopilos, Epirus, and its implications for the Palaeolithic of Greece;1993;
Rusch, L., Boulbes, N., Lartigot-Campin, A.-S., Pois, V., Testu, A., Bahain, J.-J., Falguères, C., Shao, Q., Moigne, A.-M., Saos, T., Boutié, P.;Contexte paléoenvironnemental et chronologique des occupations néandertaliennes de la grotte des Ramandils (Port-la-Nouvelle, Aude, France): apport des restes de grands mammifères;2019;
Rybin, E.P., Kharevich, V.M.;Makarovskaya zagadka: samyi rannii verkhnii paleolit Evrazii ili pribaikal'skii variant tekhnokompleksa nachal'nogo verkhnego paleolita perioda MIS-3? [The mystery of Makarovo stratum: the Earliest Upper Palaeolithic in Eurasia or a Cis-Baikalian type of the Initial Upper Palaeolithic technocomplex of MIS-3 time?];2020;
Rybin, E.P., Khatsenovich, A.M., Gunchinsuren, B., Paine, C.H., Bolorbat, T., Odsuren, D., Zwyns, N., Lkundev, G., Margad-Erdene, G.;Khronostratigraficheskie issledovaniya stoyanki Tolbor-4 (Severnaya Mongolia) [Chronostratigraphic research at the Tolbor-4 site (Northern Mongolia)];2017;
