publication_view.author;publication_view.publication_title;publication_view.publication_year
Delagnes, A., Tournepiche, J.-F., Armand, D., Desclaux, E., Diot, M.-F., Ferrier, C., Le Fillare, V., Vandermeersch, B., Diot, M.-F.;Le gisement Pléistocène moyen et supérieur d'Artenac (Saint-Mary, Charente): premier bilan interdisciplinaire;1999;
Delagnes, A., Wadley, L., Villa, P., Lombard, M.;Crystal quartz backed tools from the Howiesons Poort at Sibudu Cave;2006;
Delagnes, Anne;Analyse technologique de la methode de debitage de l'abri Suard (La Chaise-de-Vouthon, Charente);1990;
Delgado, J.F.N.;La grotte de Furninha à Peniche;1884;
Delibrias, G.;La datation par le carbone 14 des ossements de la Ferrassie;1984;
Delibrias, G., Guillier, M.T., Labeyrie, J.;Gif natural radiocarbon measurements IX;1982;
Delluc, B., Delluc, G.;L'art parietal archaique en Aquitaine;1991;
Delluc, B., Delluc, G.;Les manifestations graphiques aurignaciennes sur support rocheux des environs des Eyzies (Dordogne);1978;
Deloge, H.;Etat actuel des recherches préhistoriques dans la région de Roanne (Loire);1982;
Delpech, F.;Biostratigraphy of the Solutrean layers of Laugerie-Haute (Les Eyzies, Dordogne). Archaeological implications;2012;
Delporte, H.;Brassempouy: La grotte du Pape. Station Prehistorique. Il y a 20.000 ans...l'art;1980;
Delporte, H.;Etude monographique sur la Grotte des Fées à Châtelperron;0;
Delporte, H.;L'Aurignacien de La Ferrassie;1984;
Delporte, H.;L'abri du Facteur à Tursac (Dordogne). I. Étude Génèral;1968;
Delporte, H.;Le Mousterien d'Isturitz d'apres la Collection Passemard (Musee des Antiquites Nationales);1974;
Delporte, H.;Le gisement paléolithique de La Rochette (commune de Saint-Léon-sur-Vézère, Dordogne);1962;
Delporte, H.;Les fouilles des grottes paléolithiques de Châtelperron (Allier);1955;
Delporte, H.;Situation et historique;1984;
Delporte, H., Tuffreau, A.;Les industries du Périgordien V de La Ferrassie;1984;
Demangeot, J., Radmilli, A.M.;Le gisement quaternaire de la Valle Giumentina (Abruzzes adriatiques), Stratigraphie et Palethnologie;1953;
Demars, P.-Y.;Le gisement aurignacien de la Bombetterie, commune de Cublac (Corrèze) Essai de comparaison morphologique avec l'outillage de type aurignacien de Chanlat et Bos del Ser;1973;
Demay, L., Belyaeva, V.I., Kulakovksa, L.V., Patou-Mathis, M., Péan, S., Stupak, D.V., Vasil'ev, P.M., Otte, M., Noiret, P.;New evidences about human activities during the first part of the Upper Pleniglacial in Ukraine from zooarchaeological studies;2016;
Demay, L., Vasyliev, P.M., Belyaeva, V.I.;Subsistence activities in the gravettian occupations of the Pushkari group: Pushkari I and Pushkari VIII (Pogon) (Ukraine);2021;
Demeter, F., Bacon, A.-M., Thuy, N.K., Long, V.T., Duringer, P., Roussé, S., Coppens, Y., Matsumura, H., Dodo, Y., Huong, N.M., Tomoko, A.;Discovery of a second human molar and cranium fragment in the late Middle to Late Pleistocene cave of Ma U'Oi (Northern Vietnam);2005;
Demeter, F., Bacon, A.-M., Thuy, N.K., Long, V.T., Matsumura, H., Nga, H.H., Schuster, M., Huong, N.M., Coppens, M.;An archaic Homo molar from northern Vietnam;2004;
Demeter, F., Shackelford, L., Westaway, K., Duringer, P., Bacon, A.-M., Ponche, J.-L., Wu, X., Sayavongkhamdy, T., Zhao, J.-X., Barnes, L., Boyon, M., Sichanthongtip, P., Sénégas, F., Karpoff, A.-M., Patole-Edoumba, E., Coppens, Y., Braga, J.;Early Modern Humans and Morphological Variation in Southeast Asia: Fossil Evidence from Tam Pa Ling, Laos;2015;
Demeter, F., Shackelford, L.L., Bacon, A.-M., Duringer, P., Westaway, K., Sayavongkhamdy, T., Braga, J., Sichanthongtip, P., Khamdalavong, P., Ponche, J.-L., Wang, H., Lundstrom, C., Patole-Edoumba, E., Karpoff, A.-M.;Anatomically modern human in Southeast Asia (Laos) by 46 ka;2012;
Demidenko, Y.;"Krymskaya zagadka" - srednepaleoliticheskie izdeliya v rannem orin'yake tipa Krems-Dyufur Siureni I: al'ternativnye gipotezy dlya resheniya problemy ["The Crimean Enigma" - Middle Palaeolithic artifacts within Early Aurignacian of Krems-Dufour type complexes at Siuren I: Alternative hypothesis for solution of the problem];2012;
Demidenko, Y.;Naves Siuren-1 (Krym): Industrial'no-khronologicheskaya kolonka pamyatnika i orin'yakskie kompleksy [Rockshelter Siuren-1: Chrono-industrial column of the site and Aurignacian complexes];2002;
Demidenko, Y., Otte, M.;Siuren-I (Crimea) in the context of a European Aurignacian;2000;
Demirel, A., Andrews, P., Yalcinkaya, I., Ersoy, A.;The taphonomy and paleoenvironmental implications of the small mammals from Karain Cave;2011;
Denys, C.;Implications paléoécologiques et paléobiogéographiques de l'étude de rongeurs Plio-Pléistocènes d'Afrique orientale et australe;1990;
Derevianko, A.P., Islamov, U.I., Pavlenok, K.K., Shnaider, S.V., Shimchak, K., Kot, M., Radzhabov, A., Lazarev, S.Y.;Predvaritel'nye rezul'taty issledovaniya stoyanki Kattasai (Uzbekistan) v 2013 godu [Preliminary results of the archaeological fieldworks in Kattasai site, Uzbekistan in 2013];2013;
Derevianko, A.P., Lazarev, S.Y., Pavlenok, K.K., Shnaider, S.V., Shimchak, K., Kot, M., Radzhabov, A., Khuzhinazarov, M.;Utochnenie stratigraficheskoi situatsii na paleoliticheskoi stoyanke Kattasai (Tashkentskaya oblast', Uzbekistan) [Updates on stratigraphic situation in Paleolithic Kattasai site (Tashkent region, Uzbekistan)];2014;
Derevianko, A.P., Markin, S.V., Gladyshev, S.A., Olsen, J.W.;The Early Upper Paleolithic of the Gobi Altai region in Mongolia (Based on materials from the Chikhen-2 site);2015;
Derevianko, A.P., Markin, S.V., Kulik, N.A., Kolobova, K.A., Rybin, E.P.;Exploitation of raw material in the Hagyrskaza Cave Complexes (the Altai Mountains);2015;
Derevianko, A.P., Markin, S.V., Zykin, V.S., Zykina, V.S., Zazhigin, V.S., Sizikova, A.O., Solotchina, E.P., Smolyaninova, L.G., Antipov, A.S.;Chagyrskaya cave: a middle Paleolithic site in the Altai;2013;
Derevianko, A.P., Postnov, A.V., Chevalkov, L.M.;Geology and Quaternary Deposits of Ust-Kanskaya Cave;2001;
Derevianko, A.P., Postnov, A.V., Chevalkov, L.M.;The results of comprehensive field research in Ust-Kanskaya Cave in 1999;1999;
Derevianko, A.P., Postnov, E.V., Rybin, E.P., Kuzmin, Y.V., Keates, G.;The Pleistocene peopling of Siberia: a review of environmental and behavioural aspects;2005;
Derevianko, A.P., Powers, W.R., Shimkin, D.B.;The Paleolithic of Siberia: New discoveries and interpretations;1998;
Derevianko, A.P., Rybin, E.P., Gladyshev, S.A., Gunchinsuren, B., Tsybankov, A.A., Olsen, J.W.;Early Upper Paleolithic stone tool technologies of Northern Mongolia: The case of Tolbor-4 and Tolbor-15;2013;
Derevianko, A.P., Shunkov, M.V.;Initial Upper Palaeolithic in Altai;2004;
Derevianko, A.P., Shunkov, M.V.;The Karama Lower Paleolithic site in the Altai: initial results;2005;
Derevianko, A.P., Shunkov, M.V., Agadjanian, A.K., Baryshnikov, G.F., Malaeva, E.M., Ulianov, V.A.;Paleoenvironment and Paleolithic human occupation of Gorny Altai. Subsistence and adaptation in the vicinity of Denisova Cave;2003;
Derevianko, A.P., Shunkov, M.V., Bulatović, L., Pavlenok, K.K., Ulyanov, V.A., Kozlikin, M.B., Kandyba, A.V.;New Findings on the Middle Paleolithic of the Eastern Adriatic: The Earliest Settlement at Bioče, Montenegro;2017;
Derevianko, A.P., Shunkov, M.V., Kozlikin, M.B.;Early Upper Paleolithic Stone Tool Industries From the East Chamber of the Denisova Cave;2014;
Derevianko, A.P., Zenin, A.N., Rybin, E.P., Gladyshev, S.A., Tsybankov, A.A., Olsen, J.W., Tseveendorj, D., Gunchinsuren, B.;The technology of Early Upper Paleolithic lithic reduction in Northern Mongolia: The Tolbor-4 site;2007;
Derevyanko, A.P., Krivoshapkin, A.I., Pavlenok, K.K., Pavlenok, G.D., Shnaider, S.V., Zenin, V.N., Shalagina, A.V.;Late Middle Palaeolithic industries of the Altai Mountains New Stage of the Strashnaya Cave Study;2015;
Derndarsky, M.;Micro-wear analysis of the Middle Palaeolithic quartz artefacts from the Lurgrotte, Styria;2006;
Derndarsky, M.;Use-wear Analysis of the Chert Artefacts of the Repolusthöhle/Repolust Cave (Styria, Austria);2014;
Derradji, A.;Le site acheuléen d'Errayah (Mostaganem, Algérie) dans son contexte géologique;2006;
Desbrosse, R.;Périgordien et Aurignacien anciens de la Mère Clochette à Rochefort-sur-Nenon;1984;
Desbrosse, R., Texier, J.-P.;La Station Moustérienne de Bissy-sur-Fley (S.-et-L.);1973;
Deschamps, M.;La diversité culturelle au Paléolithique moyen récent: le Vasconien et sa signification au sein des faciès moustériens;2014;
Deschamps, M., Zilhão, J.;Assessing site formation and assemblage integrity through stone tool refitting at Gruta da Oliveira (Almonda karst system, Torres Novas, Portugal): A Middle Paleolithic case study;2018;
Desclaux, E., El Hazzazim, N., Villette, P., Dubar, M.;Le Contexte environnemental des occupations humaines: l'apport de la microfaune, des restes aviaires et de la malacofaune;2008;
Despriée, J., Courcimault, G., Voinchet, P., Jouanneau, J.C., Puaud, S., Abdessadok, S., Dépont, J., Duval, M., Lebon, M., Ingicco, T., Moncel, M.-H., Falgues, c., Bahain, J.-J.;The early pleistocene site of la Terre-des-Sablons at Lunery-Rosières (Cher department, Centre region, France): sedimentary units, ESR dating, geoarchaeological studies, prehistory;2017;
Despriée, J., Courcimault, G., Voinchet, P., Jouanneau, J.C., Puaud, S., Abdessadok, S., Dépont, J., Duval, M., Lebon, M., Ingicco, T., Moncel, M.-H., Falguères, C., Bahain, J.-J.;Le site du pléistocène inférieur de Lunery-Rosières, la Terre-des-Sablons (France, région Centre, Cher) : unités sédimentaires, datations ESR, études géoarchéologiques, préhistoire;2017;
Despriée, J., Moncel, M.-H., Arzarello, M., Courcimault, G., Voinchet, P., Bahain, J.-J., Falguères, C.;The 1‐million‐year‐old quartz assemblage from Pont‐de‐Lavaud (Centre, France) in the European context;2018;
Devièse, T., Abrams, G., Hajdinjak, M., Pirson, S., Groote, I., Di Modica, K., Toussaint, M., Fischer, V., Comeskey, D., Spindler, L., Meyer, M., Semal, P., Higham, T.;Reevaluating the timing of Neanderthal disappearance in Northwest Europe;2021;
Devièse, T., Karavanić, I., Comeskey, D., Kubiak, C., Korlević, P., Hajdinjak, M., Radović, S., Procopio, N., Buckley, M., Pääbo, S., Higham, T.;Direct dating of Neanderthal remains from the site of Vindija Cave and implications for the Middle to Upper Paleolithic transition;2017;
Dewar, G., Stewart, B.A.;Preliminary results of excavations at Spitzkloof Rockshelter, Richtersveld, South Africa;2012;
Dewez, M., Francis, A., Teheux, E.;Le Paléolithique supérieur final de la grotte Walou;2008;
Deák, J., Preusser, F., Cattin, M.I., Castel, J.C., Chauvière, F.X.;New data from the Middle Palaeolithic Cotencher cave (Swiss Jura): site formation, environment, and chronology;2019;
Di Modica, K., Hauzeur, A., Toussaint, M., Semal, P.;The stratigraphy of Spy cave. A review of the available lithostratigraphic and archaeostratigraphic information;2013;
Di Modica, K., Jungels, C., Hauzeur, A.;What do we know today about the Middle Palaeolithic in Spy?;2013;
Dibble, H.L.;The Mousterian Industry from Bisitun Cave (Iran);1984;
Dibble, H.L., Aldeias, V., Alvarez-Fernández, E., Blackwell, B.A.B., Hallett-Desguez, E., Jacobs, Z., Goldberg, P., Lin, S.C., Morala, A., Meyer, M.C., Olszewski, D.I., Reed, K., Reed, R., Rezek, Z., Richter, D., Roberts, R.G., Sandgathe, D., Schurmans, U., Skinner, A.R., Steele, T., El-Hajraoui, M.;New excavations at the site of Contrebandiers Cave, Morocco;2012;
Dibble, H.L., Aldeias, V., Goldberg, P., McPherron, S.P., Sandgathe, D., Steele, T.E.;A critical look at evidence from La Chapelle-aux-Saints supporting an intentional Neandertal burial;2015;
Dibble, H.L., Lenoir, M.;Appendix II: The Haut de Combe-Capelle, or Abri Peyrony;1995;
Dibble, H.L., Lenoir, M.;The Development of the Research Design for the Current Excavation;1995;
Dibble, H.L., Lenoir, M.;The Middle Paleolithic Site of Combe-Capelle Bas (France);1995;
Dibble, H.L., McPherron, S.P.;Description of the Lithic Industries;2009;
Dibble, H.L., McPherron, S.P., Sandgathe, D., Goldberg, P., Turq, A., Lenoir, M.;Context, curation, and bias: an evaluation of the Middle Paleolithic collections of Combe-Grenal (France);2009;
Didon, L.;L'abri Blanchard des roches (Commune de Sergeac). Gisement aurignacien moyen;1911;
Diebel, K., Pietrzeniuk, E.;Die Ostrakodenfauna aus den jungpleistozänen (weichselkaltzeitlichen) Deckschichten von Burgtonna in Thüringen;1978;
Diebel, K., Pietrzeniuk, E.;Die Ostrakodenfauna des eeminterglazialen Travertins von Burgtonna in Thüringen;1978;
Diebel, K., Pietrzeniuk, E.;Jungpleistozäne Ostrakoden aus Sedimenten der Parkhöhlen von Weimar;1984;
Dietl, H.;Die Freilandfundstellen von Geelbek und Anyskop in Südafrika: das Siedlungsverhalten während des Middle Stone Age;2004;
Dietl, H., Kandel, A.W., Conard, N.J.;Middle Stone Age Settlement and Land Use at the Open-Air Sites of Geelbek and Anyskop, South Africa;2005;
Dietrich, M.;Auf den Spuren des Urmenschen. Die Funde von Bilzingsleben;1990;
Dietrich, M., Dieter-Hand, M.;Molluskenfaunen und Floren im Elbe-Saalegebiet während des mittleren Eiszeitalters;2001;
Diez-Martin, F., Sánchez-Yustos, P., Gómez-González, J.A., Gómez de la Rúa, D.;Earlier Palaeolithic Settlement Patterns: Landscape Archaeology on the River Duero Basin Plateaus (Castilla y León, Spain);2008;
Diez-Martin, F., Sánchez-Yustos, P., Gómez-González, J.A., Gómez de la Rúa, D.;La ocupacion paleolitica en los paramos del Duero: nuevos datos procedentes de Valdecampana (Olivares de Duero, Valladolid);2008;
Digan, M.;La Vigne-Brun (Villerest, Loire): un siècle d’histoire d’un site original et important pour la compréhension du Gravettien;2007;
Digan, M.;Le Gisement Gravettien de la Vigne-Brun (Loire, France). Étude de l'industrie lithique de l'Unité KL19;2006;
Digan, M.;New technological and economic data from La Vigne-Brun (unit KL19), Loire: a contribution to the identification of early Gravettian lithic technological expertise;2008;
Dini, M., Bailis, H., Conforti, J., Tozzi, C.;Le Protoaurignacien de la Grotte La Fabbrica (Grosseto, Italie) dans le contexte de l'arc nord méditerranéen;2012;
Dini, M., Baills, H., Tozzi, C.;Pontecosi: un site aurignacien en Toscane (Italie);2010;
Dini, M., Tozzi, C.;La Transizione Paleolitico Medio-Paleolitico Superiore nella Grotta La Fabbrica (Grosseto-Toscana);2012;
Dinnis, R.;On the technology of Late Aurignacian burin and scraper production, and the importance of the Paviland lithic assemblage and the Paviland burin;2008;
Dinnis, R.;The timing of Aurignacian occupation of the British Peninsula. Die Chronologie des Aurignacien auf der britischen Halbinsel;2012;
Dinnis, R., Bessudnov, A.A., Reynolds, N., Devièse, T., Pate, A., Sablin, M., Sinitsyn, A.A., Higham, T.;New data for the early Upper Paleolithic of Kostenki (Russia);2019;
Dinnis, R., Bessudnov, A.A., Reynolds, N., Douka, K., Dudin, A.E., Khlopachev, G.A., Sablin, M.V., Sinitsyn, A.A., Higham, T.F.G.;The Age of the ‘Anosovka-Tel’manskaya Culture’ and the Issue of a Late Streletskian at Kostёnki 11, SW Russia;2018;
Dirian, A.;Das späte Jungpaläolithikum und das Spätpaläolithikum der oberen Schichten der Sesselfelsgrotte;2003;
Dirian, A.;Die Steinartefakte der jungpaläolithischen Freilandfundstelle Regensburg, Florian Seidl-Straße (Grabung 1986-87);1990;
Dirks, P.H., Berger, L.R., Roberts, E.M., Kramers, J.D., Hawks, J., Randolph-Quinney, P.S., Elliott, M., Musiba, C.M., Churchill, S.E., de Ruiter, D.J., Schmid, P., Backwell, L.R., Belyanin, G.A., Boshoff, P., Hunter, K.L., Feuerriegel, E.M., Gurtov, A., Harrison, J.d.G., Hunter, R., Kruger, A., Morris, H., Makhubela, T.V., Peixotto, B., Tucker, S.;Geological and taphonomic context for the new hominin species Homo naledi from the Dinaledi Chamber, South Africa;2015;
Dirks, P.H., Kibii, J.M., Kuhn, B.F., Steininger, C., Churchill, S.E., Kramers, J.D., Pickering, R., Farber, D.L., Meriaux, A.S., Herries, A.I., King, G.C., Berger, L.R.;Geological Setting and Age of Australopithecus sediba from Southern Africa;1978;
Dirks, P.H., Roberts, E.M., Hilbert-Wolf, H., Kramers, J.D., Hawks, J., Dosseto, A., Duval, M., Elliott, M., Evans, M., Grün, R., Hellstrom, J., Herries, A.I.R., Joannes-Boyau, R., Makhubela, T.V., Placzek, C.J., Robbins, J., Spandler, C., Wiersma, J., Woodhead, J., Berger, L.R.;The age of Homo naledi and associated sediments in the Rising Star Cave, South Africa;2017;
Ditchfield, P., Hicks, J., Plummer, T., Bishop, L.C., Potts, R.;Current research on the Late Pliocene and Pleistocene deposits north of Homa Mountain, southwestern Kenya;1999;
Dizon, E.;New direct dating of the human fossils from Tabon Cave, Palawan, Philippines;2003;
Dizon, E., Détroit, F., Sémah, F., Falguères, C., Hameau, S., Ronquillo, W., Cabanis, E.;Notes on the morphology and age of the Tabon Cave fossil Homo sapiens;2002;
Djamali, M., de Beaulieu, J.-L., Shah-hosseini, M., Andrieu-Ponel, V., Ponel, P., Amini, A., Akhani, H., Leroy, S.A.G., Stevens, L., Lahijani, H., Brewer, S.;A late Pleistocene long pollen record from Lake Urmia, Nw Iran;2008;
Djerrab, A., Camps, P.;Propriétés magnétiques du remplissage de la Caverna delle Manie (Finale Ligurie, Italie);2010;
Djindjian, F.;La Grotte Boccard à Créancey (Côte d'Or);2005;
Djindjian, F., Genreau, F., Gommery, D., Pautrat, Y.;Préhistoire du Nord-Est Bourguignon. 50ème anniversaire e la découverte de l'homme de Genay;2005;
Djindjian, F., Kozlowski, J., Otte, M.;Le Paléolithique Supérieur en Europe;1999;
Doboş, A., Soficaru, A., Trinkaus, E.;The prehistory and paleontology of the Peştera Muierii (Romania);2010;
Dobrovolskaya, M., Richards, M.-P., Trinkaus, E.;Direct radiocarbon dates for the Mid Upper Paleolithic (eastern Gravettian) burials from Sunghir, Russia;2012;
Dogandžić, T., Đuričić, L.;Lithic production strategies in the Middle Paleolithic of the southern Balkans;2017;
Dolakova, N.;Palynological studies of the sediments from the Sosuvka part of the Sloup-Sosuvka Cave and from the lower part of the supporting profile in the Kulna Cave;2002;
Dolakova, N.;Palynologicka analyza vzorku z moravskeho Krumlova IV;2009;
Dolukhanov, P., Sokoloff, D., Shukurov, A.;Radiocarbon Chronology of Upper Palaeolithic Sites in Eastern Europe at Improved Resolution;2001;
Dombek, G., Hahn, J.;Radiocarbondatierungen - Die chronologische Stellung von Lommersum im Aurignacian nach 14C-Daten;1989;
Domínguez-Rodrigo, M., Alcalá, L., Luque, L.;Peninj: A Research Project on Human Origins, 1995-2005;2009;
Domínguez-Rodrigo, M., Pickering, T.R., Semaw, S., Rogers, M.J.;Cutmarked bones from Pliocene archaeological sites at Gona, Afar, Ethiopia: implications for the function of the world s oldest stone tools;2005;
Domínguez-Rodrigo, M., de La Torre, I., de Luque, L., Alcalá, L., Mora, R., Serrallonga, J., Medina, V.;The ST Site Complex at Peninj, West Lake Natron, Tanzania: Implications for Early Hominid Behavioural Models;2002;
Donahue, R.E., Murphy, M.L., Robbins, L.H.;Lithic Microwear Analysis of Middle Stone Age Artifacts from White Paintings Rock Shelter, Botswana;2002;
Dong, W., Xu, Q., Jin, C., Liu, J.;Quaternary herbivore fauna in northeastern China: Evolution under climatic change;1999;
Doronichev, V.B.;Le Paléolithique ancien de l'Europe orientale et du Caucase;2011;
Doronichev, V.B.;The Lower Paleolithic in Eastern Europe and the Caucasus: A reappraisal of the data and new approaches;2008;
Doronichev, V.B., Blackwell, B.A.B., Golovanova, L.V., Levkovskaya, G.M., Pospelova, G.A.;Treugolnaya Cave in the Northern Caucasus, Russia: Chronology, paleoenvironments, industries, and relationship to the Lower Paleolithic in Eastern Europe;2004;
Doronichev, V.B., Golovanova, L.V., Baryshnikov, G.F., Blackwell, B.A.B., Garutt, G.M., Levkovskaya, G.M., Molodkov, A.N., Nesmeyanov, S.A., Pospelova, G.A., Hoffecker, J.F.;Treugolnaya Cave in the Northern Caucasus, Russia and the Early Palaeolithic in Caucasus and Eastern Europe;2007;
Doronicheva, E.V.;Syr'evye strategii drevnego cheloveka v srednem paleolite na severo-zapadnom Kavkaze [Raw material strategies during the Middle Palaeolithic in north-western Caucasus];2011;
Douglas, R.M.;Formation of the Florisbad spring and fossil site - an alternative hypothesis;2006;
Douka, K.;An Upper Palaeolithic shell scraper from Ksar Akil (Lebanon);2011;
Douka, K., Bergman, C., Hedges, R., Wesselingh, F., Higham, T.;Chronology of Ksar Akil (Lebanon) and Implications for the Colonization of Europe by Anatomically Modern Humans;2013;
Douka, K., Grimaldi, S., Boschian, G., del Lucchese, A., Higham, T.F.G.;A new chronostratigraphic framework for the Upper Palaeolithic of Riparo Mochi (Italy);2012;
Douka, K., Higham, T., Sinitsyn, A.A.;The influence of pretreatment chemistry on the radiocarbon dating of Campanian Ignimbrite-aged charcoal from Kostenki 14 (Russia);2010;
Douka, K., Higham, T.F.G., Wood, R., Boscato, P., Gambassini, P., Karkanas, P., Peresani, M., Ronchitelli, A.M.;On the chronology of the Uluzzian;2014;
Douka, K., Slon, V., Jacobs, Z., Ramsey, C.B., Shunkov, M.V., Derevianko, A.P., Mafessoni, F., Kozlikin, M.B., Li, B., Grün, R., Comeskey, D., Devièse, T., Brown, S., Viola, B., Kinsley, L., Buckley, M., Meyer, M., Roberts, R.G., Pääbo, S., Keslo, J., Higham, T.;Age estimates for hominin fossils and the onset of the Upper Palaeolithic at Denisova Cave;2019;
Douka, K., Spinapolice, E.E.;Neanderthal Shell Tool Production: Evidence from Middle Palaeolithic Italy and Greece;2012;
Doukas, C., van Kolfschoten, T., Papayianni, K., Panagopoulou, E., Harvati, K.;The small mammal fauna from the palaeolithic site Marathousa 1 (Greece);2018;
Draily, C.;Campagnes de fouille 1996-1998 à la grotte Wwalou à Trooz;1998;
Draily, C.;Les occupations moustériennes de la grotte Walou (Trooz);2011;
Drake, R., Curtis, G.H.;K-Ar geochronology of the Laetoli fossil localities;1987;
Drapeau, M.S.M., Ward, C.V., Kimbel, W.H., Johanson, D.C., Rak, Y.;Associated cranial and forelimb remains attributed to Australopithecus afarensis from Hadar, Ethiopia;2005;
Drennan, M.R.;An Australoid Skull from the Cape Flats;1929;
Drescher-Schneider, R.;Die Vegetations-und Klimaentwicklung im Riss/Würm-Inter-Glazial und im Früh-und Mittelwürm in der Umgebung von Mondsee. Ergebnisse der pollenanalytischen Untersuchungen;2000;
Drobniewicz, B., Ginter, B., Kazior, B., Kozlowski, J.;'Transitional' industry from layer VI, trench TD-II;2000;
Drobniewicz, B., Ginter, B., Kozlowski, J.;The Gravettian sequence;1992;
Drozdov, N.I., Artemiev, E.V.;The Paleolithic site of Afontova Gora: Recent findings and new issues;2007;
Drozdowski, E., Tobolski, K.;Stanowiska interglacjału eemskiego w Basenie Grudziądzkim;1972;
Du, S., Li, X., Zhou, L., Pang, H., Bar-Yosef, O., Wu, X.;Longquan Cave: an early Upper Palaeolithic site in Henan Province, China;2016;
Dubois, A.;Les Fouilles de la Grotte de Cotencher;1920;
Duller, G.A.T., Tooth, S., Barham, L., Tsukamoto, S.;New investigations at Kalambo Falls, Zambia: Luminescence chronology, site formation, and archaeological significance;2015;
Dupree, L., Angel, J.L., Brill, R.H., Caley, E.R., Davis, R.S., Kolb, C.C., Marshack, A., Perkins, D., Solem, J., Solem, A.;Prehistoric Research in Afghanistan (1959-1966);1972;
Duran, J.-P., Tavoso, A.;Les industries moustériennes de la Rouquette (Puycelci, Tarn, France);2005;
Dusseldorp, G., Lombard, M., Wurz, S.;Pleistocene Homo and the updated Stone Age sequence of South Africa;2013;
Dutkiewicz, E.;The Vogelherd Cave and the discovery of the earliest art - history, critics and new questions;2015;
Duval, M., Bahain, J.-J., Falguères, C., Garcia, J., Guilarte, V., Grün, R., Martínez, K., Moreno, D., Shao, Q., Voinchet, P.;Revisiting the ESR chronology of the Early Pleistocene hominin occupation at Vallparadís (Barcelona, Spain);2015;
Duval, M., Falguères, C., Bahain, J.-J.;Age of the oldest hominin settlements in Spain: Contribution of the combined U-series/ESR dating method applied to fossil teeth;2012;
Duval, M., Grün, R., Parés, J.M., Martín-Francés, L., Campaña, I., Rosell, J., Shao, Q., Arsuaga, J.L., Carbonell, E., Bermúdez de Castro, J.M.;The first direct ESR dating of a hominin tooth from Atapuerca Gran Dolina TD-6 (Spain) supports the antiquity of Homo antecessor;2018;
Duveau, J.;Supplementary Information: Direct evidence of the composition of a Neandertal social group: the hominin footprints at Le Rozel (Normandy, France);2021;
Duveau, J., Berillon, G., Verna, C.;On the Tracks of Neandertals: The Ichnological Assemblage from Le Rozel (Normandy, France);2021;
Dzaparidze, V., Bosinski, G., Bugianisvili, T., Gabunia, L., Justus, A., Klopotovskaja, N., Kvavadze, E., Lordkipanidze, D., Majsuradze, G., Mgeladze, N., Nioradze, M., Pavlenisvili, E., Schmincke, H.-U., Sologasvili, D., Tusabramisvili, D., Tvalcrelidze, M., Vekua, A.;Der altpaläolithische Fundplatz Dmanisi in Georgien (Kaukasus);1989;
Détroit, F., Dizon, E., Falgueres, C., Hameau, S., Ronquillo, W., Sémah, F.;Upper Pleistocene Homo sapiens from the Tabon cave (Palawan, The Philippines): description and dating of new discoveries;2004;
Döppes, D.;Die jungpleistozäne Säugetierfauna der Gudenushöhle (Niederösterreich);1997;
Döppes, D., Kempe, S., Rosendahl, W.;Dated paleontological cave sites of Central Europe from Late Middle Pleistocene to early Upper Pleistocene (OIS 5 to OIS 8);2008;
Döppes, D., Rabeder, G., Cech, P.;Pliozäne und pleistozäne Faunen Österreichs: ein Katalog der wichtigsten Fossilfundstellen und ihrer Faunen;1997;
Eberz, G., Williams, F., Williams, M.;Plio-Pleistocene volcanism and sedimentary facies changes at Gadeb prehistoric site, Ethiopia;1988;
Echassoux, A.;Taphonomy, palaeoecology and zooarchaeology ofthe lower Pleistocene mammals of Vallonnet cave (Roquebrune-Cap-Martin, Alpes-Maritimes, France);2004;
