publication_view.author;publication_view.publication_title;publication_view.publication_year
Kühner, R.;Entstehung, Schichtenfolge und Lagerungsverhältnisse des Eem-Vorkommens Jänschwalde;2014;
La Porta, A.O., Moncel, M.-H., Raynal, J.-P.;Preliminary results of Middle Paleolithic points from the sites of Abri Du Maras and Baume-Vallée (South-eastern France): technological analysis and some remarks on macro-traces;2015;
LaReau, H., Rink, W.J., Schepartz, L., Miller-Antonio, S., Weiwen, H., Hou, Y.-M., Wang, W.;Coupled electron spin resonance (ESR)/uranium-series dating of mammalian tooth enamel at Panxian Dadong, Guizhou Province, China;2004;
Lacarrière, J., Bodu, P., Julien, M.-A., Dumarçay, G., Goutas, N., Lejay, M., Peschaux, C., Naton, H.-G., Théry-Parisot, I., Vasiliu, L.;Les Bossats (Ormesson, Paris basin, France): A new early Gravettian bison processing camp;2015;
Lacarrière, J., Goutas, N., Normand, C., Simonet, A., Schwab, C.;Vers une redefinition des occupations gravettiennes de la grotte d'Isturitz (Pyrenees Atlantiques, France): Revision critique des collectiones anciennes par l'approche integree des nonnees lithiques, fauniques et de l'industrie osseuse;2011;
Lacruz, R.S.;Enamel microstructure of the hominid KB 5223 from Kromdraai, South Africa;2007;
Lacruz, R.S., Brink, J.S., Hancox, P.J., Skinner, A.R., Herries, A., Schmid, P., Berger, L.R.;Palaeontology and geological context of a middle Pleistocene faunal assemblage from the Gladysvale Cave, South Africa;2002;
Lacruz, R.S., Ramirez Rozzi, F.V.;Molar crown development in Australopithecus afarensis;2010;
Laforge, M., Monnier, J.-L.;Contribution à la chronostratigraphie du gisement paléolithique inférieur de Menez-Dregan 1 (Plouhinec, Finistère, France);2011;
Laird, M.F., Schroeder, L., Garvin, H.M., Scott, J.E., Dembo, M., Radovčić, D., Musiba, C.M., Ackermann, R.R., Schmid, P., Hawks, J., Berger, L.R., Ruiter, D.J.;The skull of Homo naledi;2017;
Lalanne, G.;L'abri des carrières dit Abri Audi. Station de la fin de l'époque mousterienne;1909;
Lalanne, J.G., Bouyssonie, J.;Le gisement paléolithique de Laussel. Fouilles du Dr. Lalanne;1941;
Lalueza, C., Pérez-Pérez, A., Turbón, D.;Microscopic study of the Banyoles mandible (Girona, Spain): diet, cultural activity and toothpick use;1993;
Lalueza-Fox, C., Rosas, A., de la Rasilla, M.;Palaeogenetic research at the El Sidrón Neanderthal site;2012;
Lamothe, M.;Analysis report, Laboratoire de Luminescence, UQAM, 9;1997;
Lamotte, A.;La série moustérienne du Trou de le Mère Clochette;2009;
Lanfranchi, R.;Une Industrie M.S.A. de Stone-Line en Forêt Dense: Le Site de Mokeko (Congo);1996;
Lanfranchi, R.;Une industrie MSA de stone-line en forêt dense: le site de Mokeko (Congo);1996;
Lang, J., Winsemann, J.;The 12II DB outcrop section at Schöningen: sedimentary facies and depositional architecture;2012;
Laplace, G.;Il Riparo Mochi ai Balzi Rossi di Grimaldi (Scavi 1939-1949). Les industries leptolithiques;1977;
Laplace, G.;Recherches sur l'origine et l'évolution des complexes leptolithiques;1966;
Laplace, G., de Buruaga, A.S.;Typologie analytique et structurale des complexes du Moustérien de la Grotte Gatzarria (Ossas-Suhare, Pays Basque) et de leurs relations avec ceux de l'Abri Olha 2 (Cambo, Pays Basque);2002;
Laplace, G., de Buruaga, S.A.;Application de la typologie analytique et structurale a l'etude de l'outillage mousteroide de l'abri Olha 2 a Cambo (Kanbo) en Pays Basque;2000;
Laplace-Jauretche, G.;Decouverte d'un gisement a galets tailles (Pebble culture) dans le quaternaire ancien du plateau de Mansourah (Constantine);1956;
Laplace-Jauretche, G.;Découverte de galets taillés (Pebble culture) dans le quaternaire ancien de Mansourah (Constantine);1956;
Lari, M., Di Vincenzo, F., Borsato, A., Ghirotto, S., Micheli, M., Balsamo, C., Collina, C., De Bellis, G., Frisia, S., Giacobini, G., Gigli, E., Hellstrom, J.C., Lannino, A., Modi, A., Pietrelli, A., Pilli, E., Profico, A., Ramirez, O., Rizzi, E., Vai, S., Venturo, D., Piperno, M., Lalueza-Fox, C., Barbujani, G., Caramelli, D., Manzi, G.;The Neanderthal in the karst: First dating, morphometric, and paleogenetic data on the fossil skeleton from Altamura (Italy);2012;
Larick, R., Ciochon, R.L., Zaim, Y., Sudijono, S., Rizal, Y., Aziz, F., Reagan, M., Heizler, M.;Early Pleistocene 40 Ar/39 Ar ages for Bapang Formation Hominins, Central Jawa, Indonesia;2001;
Laroulandie, V., d’Errico, F.;Worked bones from Buran-Kaya III level C and their taphonomic context;2004;
Lartet, L.;Une sépulture des troglodytes du Périgord (crânes des Eyzies);1868;
Latham, A.G., Herries, A.I.R.;The formation and sedimentary infilling of the Cave of Hearths and Historic Cave complex, Makapansgat, South Africa;2004;
Latridou, J.-P., Cliquet, D., Schwenninger, J.-L., Coutard, S.;Etude des Remplissages Tertiaires et Quaternaires des Dolines du Plateau Crayeux Karstifie du Long-Buisson a Guichainville / Le Vieil-Evreux (Eure): Chronostratigraphie des Niveaux Anthropiques;2013;
Laukhin, S.A., Akimova, E.V., Ovodov, N.D., Drozdov, N.I., Stasyuk, I.V., Tomilova, E.A.;Geologicheskaya obstanovka srednepleistotsenovoi paleoliticheskoi stoyanki Ust'-Izhul' 1 (Yug Srednei Sibiri) [Geological context of the Middle Pleistocene Palaeolithic site Ust'-Izhul' 1 (southern Central Siberia)];1999;
Laukhin, S.A., Gnibidenko, Z.N.;Palaeomagnetic investigations of the Pleistocene deposits of the Ust'-Izhul' section;1999;
Laury, R.L., Albritton, C.C.J.;Geology of Middle Stone Age Archaeological Sites in the Main Ethiopian Rift Valley;1975;
Lautridou, J.P., Vernon, G.;Paléosols et loess de Saint-Pierre-lès-Elbeuf (Seine-Maritime);1970;
Laville, H.;Climatologie et chronologie du Paleolithique en Perigord: etude sedimentologique de depots en grottes et sous abris;1973;
Laville, H., Sonneville-Bordes, D.d.;Sédimentologie des niveaux moustériens et aurignaciens de Caminade-Est (Dordogne;1967;
Laville, H., Tuffreau, A.;Les dêpots du grand abri de La Ferrassie: stratigraphie, signification climatique et chronologie;1984;
Lbova, L.;The Siberian Paleolithic site of Mal'ta: a unique source for the study of childhood archaeology;2021;
Lbova, L., Volkov, P.;Processing technology for the objects of mobile art in the Upper Paleolithic of Siberia (the Malta site);2016;
Lbova, L.V.;Chronology and paleoecology of the Early Upper Paleolithic in the Transbaikal region (Siberia);2008;
Lbova, L.V.;Paleolit severnoi zony Zapadnogo Zabaikal'ya [Palaeolithic of the northern zone of the Western Trans-Baikal region];2000;
Lbova, L.V.;Pigments on Upper Palaeolithic mobile art. Spectral analysis of figurines from Mal'ta culture (Siberia);2019;
Le Bourdonnec, F.-X., Nomade, S., Poupeau, G., Guillou, H., Tushabramishvili, N., Moncel, M.-H., Pleurdeau, D., Agapishvili, T., Voinchet, P., Mgeladze, A., Lordkipanidze, D.;Multiple origins of Bondi Cave and Ortvale Klde (NW Georgia) obsidians and human mobility in Transcaucasia during the Middle and Upper Palaeolithic;2012;
Le Brun-Ricalens, F.;L'occupation aurignacienne d'Hui (Beauville, Lot-et-Garonne). Présentation, problèmatique et premiers résultats;1990;
Le Brun-Ricalens, F.;Reconnaissance d'un "concept technoculturel" de l'Aurignacien ancien? Modalités, Unités et Variabilités des productions Lamellaires du site d'Hui (Beauville, Lot-et-Garonne, France): Significations et Implications;2005;
Le Tensorer, J.-M.;Grotte de Cassegros;1976;
Le Tensorer, J.-M.;Les cultures acheuleennes et la question de l’emergence de la pensee symbolique chez Homo erectus a partir des données relatives a la forme symétrique et harmonique des bifaces;2006;
Le Tensorer, J.-M.;L’image avant l’image: reflexions sur le colloque;2009;
Le Tensorer, J.-M., Hauck, T.C., Wojtczak, D., Schmid, P., Schuhmann, D.;Resultats de la campagne 2006-2007. Rapports Annuels de la Mission Archéologique d’El Kowm (Syrie) de l’Institut de Préhistoire et Science de l’Archéologie de l’Université de Bâle;2007;
Le Tensorer, J.-M., Jagher, R., Hauck, T.C.;Projet: le Paléolithique d'El Kowm: résultats de la campagne 2003. Rapports Annuels de la Mission Archéologique d’El Kowm (Syrie) de l’Institut de Préhistoire et Science de l’Archéologie de l’Université de Bâle;2003;
Le Tensorer, J.-M., Muhesen, S.;Les premiers hommes du desert syrien - Fouille syrio-suisse a Nadaouiyeh Ain Askar;1997;
Le Tensorer, J.-M., von Falkenstein, V., Le Tensorer, H., Muhesen, S.;Hummal: a very long Paleolithic sequence in the steppe of central Syria - Considerations on Lower Paleolithic and the beginning of Middle Paleolithic;2011;
Le Tensorer, J.-M., von Falkenstein, V., Le Tensorer, H., Schmid, P., Muhesen, S.;Etude preliminaire des industries archaiques de facies Oldowayen du site de Hummal (El Kowm, Syrie centrale);2011;
Le Tensorer, J.M.;Le Yabroudien et la transition du Paleolithique ancien au Paleolithique moyen en Syrie: l'example d'el Kowm;2005;
Le Tensorer, J.M., Jagher, R., Rentzel, P., Hauck, T., Ismail-Meyer, K., Pümpin, C., Wojtczak, D.;Long-term site formation processes at the natural springs Nadaouiyeh and Hummal in the El Kowm Oasis, Central Syria;2007;
Leader, G.M.;Early Acheulean in the Vaal River basin, Rietputs Formation, Northern Cape Province, South Africa;2009;
Leakey, L.;The industries of the Gorgora rock-shelter, Lake Tana;1943;
Leakey, M.D.;Discovery of Postcranial Remains of Homo erectus and Associated Artefacts in Bed IV at Olduvai Gorge, Tanzania;1971;
Leakey, M.D., Harris, J.;Laetoli, A Pliocene site in Northern Tanzania;1987;
Leakey, M.D., Hay, R.L., Thurber, D.L., Protsch, R., Berger, R.;Stratigraphy, Archaeology, and Age of the Ndutu and Naisiusiu Beds, Olduvai Gorge, Tanzania;1972;
Leakey, M.G., Spoor, F., Brown, F.H., Gathogo, P.N., Kiarie, C., Leakey, L.N., McDougall, I.;New hominin genus from eastern Africa shows diverse middle Pliocene lineages;2001;
Leakey, R.E.F.;New Hominid Remains and Early Artefacts from Northern Kenya: Fauna and Artefacts from a New Plio-Pleistocene Locality near Lake Rudolf in Kenya;1970;
Leakey, R.E.F., Walker, A.;New Australopithecus boisei specimens from east and west Lake Turkana, Kenya;1988;
Leakey, R.E.F., Wood, B.A.;New evidence of the genus Homo from East Rudolf, Kenya (IV);1974;
Lebatard, A.-E., Bourlès, D.L., Alçiçek, M.C.;Datation des travertins de Kocabaş par la méthode des nucléides cosmogéniques 26Al/10Be;2014;
Lebegue, F., Boulbes, N., Gregoire, S., Moigne, A.-M.;Systèmes d'occupation, exploitation des ressurces et mobilité des Néanderthaliens de L'Hortus;2012;
Lebel, S., Trinkaus, E.;New discoveries of Middle Paleolithic human remains from the Bau de l'Aubesier (Vaucluse, France);2001;
Lebel, S., Trinkaus, E., Faure, M., Fernandez, P., Guérin, C., Richter, D., Mercier, N., Valladas, H., Wagner, G.A.;Comparative morphology and paleobiology of Middle Pleistocene human remains from the Bau de l'Aubesier, Vaucluse, France;2001;
Lebreton, V.;Paysages et climats des premiers hominidés en Italie;2004;
Lebreton, V., Campin, A.-S., Karatsori, E., Messager, E., Marquer, L., Renault-Miskovsky, J.;Potentials and limits of pollen analysis on Quaternary spelothems: an attempt to reconstruct the vegetal environment of prehistoric human in the Northern Mediterranean;2007;
Leca, J.B., Gunst, N., Huffman, M.A.;Principles and levels of laterality in unimanual and bimanual stone handling patterns by Japanese macaques;2010;
Leder, D., Hermann, R., Hüls, M., Russo, G., Hoelzmann, P., Nielbock, R., Böhner, U., Lehmann, J., Meier, M., Schwalb, A., Tröller-Reimer, A., Koddenberg, T., Terberger, T.;A 51,000-year-old engraved bone reveals Neanderthals’ capacity for symbolic behaviour;2021;
Lee, A.Y.-C., Jacob, T., Deniaux, B.;Preliminary examination of buccal dental microwear in Javanese hominids;2004;
Lee, C., Jeffrey, L.B., Peterson, E.;Amino acids in modern and fossil woods;1976;
Lee, E. J., Merriwether, D. A., Kasparov, A., Khartanovich, V. I., Nikolskiy, P. A., Shidlovskiy, F. K., Gromov, A. V., Chikisheva, T. A., Chasnyk, V. G., Timoshin, V. B., Pavlova, E. Y., Pitulko, V. V.;A genetic perspective of prehistoric hunter-gatherers in the Siberian Arctic: Mitochondrial DNA analysis of human remains from 8000 years ago;2018;
Lee, J.R., Rose, J., Candy, I., Barendregt, R.W.;Sea-level changes, river activity, soil development and glaciation around the western margins of the southern North Sea Basin during the Early and early Middle Pleistocene: evidence from Pakefield, Suffolk, UK;2006;
Lee-Thorp, J.A., Ecker, M.;Holocene Environmental Change at Wonderwerk Cave, South Africa: Insights from Stable Light Isotopes in Ostrich Eggshell;2015;
Lefort, J.-P., Monnier, J.-L., Marcoux, N.;Apport de la géologie marine à la détermination des sources de matières premières au paléolithique dans le massif armoricain: origine possible du silex utilisé sur les stations paléolithique inférieur de Menez-Dregan (Plouhinec, Finistère, France). Implications paléoclimatiques et paléoenvironnementales;2007;
Lefèvre, D., Raynal, J.-P., Vernet, G., Kieffer, G., Piperno, M.;Tephro-stratigraphy and the age of ancient Southern Italian Acheulean settlements: The sites of Loreto and Notarchirico (Venosa, Basilicata, Italy);2010;
Leierer, L., Jambrina-Enríquez, M., Herrera-Herrera, A.V., Connolly, R., Hernández, C.M., Galván, B., Mallol, C.;Insights into the timing, intensity and natural setting of Neanderthal occupation from the geoarchaeological study of combustion structures: A micromorphological and biomarker investigation of El Salt, unit Xb, Alcoy, Spain;2019;
Lejay, M.;Approche archéologique et expérimentale des structures de combustion au Paléolithique supérieur ancien: analyse multiscalaire (micromorphologie et géochimie organique) appliquée aux sites de Régismont-le-Haut et des Bossats;2018;
Lengyel, G.;Lithic economy of the Upper Paleolithic and Epipaleolithic of Raqefet cave;2009;
Lengyel, G., Boaretto, E., Fabre, L., Ronen, A.;New AMS 14C dates from the early Upper Paleolithic sequence of Raqefet cave, Mount Carmel, Israel;1967;
Lengyel, G., Nadel, D., Tsatskin, A., Bar-Oz, G., Bar-Yosef-Mayer, D.E., Be'eri, R., Hershkovitz, I.;Back to Raqefet cave, Mount Carmel, Israel;2005;
Lenoble, A., Ortega, I., Bourguignon, L.;Processus de formation du site mousterien de Camps-de-Boussuet (Gironde);2000;
Lenoir, M., Roussot, A., Delluc, B., Delluc, G., Martinez, M., Loizeau, S., Memoire, N.;La grotte de Pair-non-Pair à Prignac-et-Marcamps (Gironde);2006;
Leonardi, P.;Notizie riassuntive sui risultati delle ricerche nella Grotta di Paina sui Colli Berici (Vicenza, Italia)., t. I, 1988, págs. 93-110;1988;
Leonardi, P., Broglio, A.;Il Bernardiniano, nuova industria litica musteriana;1962;
Leplongeon, A.;Microliths in the Middle and Later Stone Age of eastern Africa: New data from Porc-Epic and Goda Buticha cave sites, Ethiopia;2014;
Lepre, C.J., Roche, H., Kent, D.V., Harmand, S., Quinn, R.L., Brugal, J.-P., Texier, P.-J., Lenoble, A., Feibel, C.S.;An earlier origin for the Acheulian;2011;
Leroi-Gourhan, A.;Antiquités Préhistoriques, IIe Circonscription (1948);1948;
Leroi-Gourhan, A.;Les fouilles d'Arcy-sur-Cure (Yonne);1961;
Leroi-Gourhan, A.;Résultats de l'analyse pollinique de la grotte d'Isturitz;1959;
Leroi-Gourhan, A.;Stratigraphie et découvertes récentes dans les grottes d'Arcy-sur-Cure (Yonne);1952;
Leroi-Gourhan, A., Leroi-Gourhan, A.;Chronologie des grottes d'Arcy-sur-Cure (Yonne);1964;
Leroy, S.A.G., Roiron, P.;Latest Pliocene pollen and leaf floras from Bernasso palaeolake (Escandorgue Massif, Hérault, France);1996;
Leroy-Prost, C.;L'industrie osseuse aurignacienne de la collection Passemard d'Isturitz (Pyrenees-Atlantiques);1974;
Lesage, C., Postnov, A.V., Krivoshapkin, A.I., Jaubert, J.;Levallois reduction sequences in Altai: A view from the study of Ust'-Kanskaya Cave (Gorny-Altai, Russia);2020;
Leveque, F., Miskovski, J.-C.;Le Castelperronien dans son environnement géologique. Essai de synthèse à partir de l'étude lithostratigraphique du remplissage de la grotte de la grande Roche de la Plématrie (Quincay, Vienne) et d'autres dépôts actuellement mis au jour;1983;
Levine, M.A.;Archaeo-zoological Analysis of Some Upper Pleistocene Horse Bone Assemblages in Western Europe;1979;
Lewis, H.;Preliminary soil micromorphology studies of landscape and occupation history at Tabon Cave, Palawan, Philippines;2007;
Lewis, S.G.;Pleistocene stratigraphy and sedimentology;2012;
Lewis, S.G., Ashton, N., Davis, R., Hatch, M., Hoare, P.G., Voinchet, P., Bahain, J.-J.;A revised terrace stratigraphy and chronology for the early Middle Pleistocene Bytham River in the Breckland of East Anglia, UK;2021;
Lewis, S.G., Ashton, N., Field, M.H., Hoare, P.G., Kamermans, H., Knul, M., Mücher, H.J., Parfitt, S.A., Roebroeks, W., Sier, M.J.;Human occupation of northern Europe in MIS 13: Happisburgh Site 1 (Norfolk, UK) and its European context;2019;
Lhomme, V.;Industries lithiques du Paléolithique moyen à nombreuses fractures. Les exemples du secteur sud de Champlost (Yonne) et de le Couche inférieure de "Chez-Pourré - Chez-Compte" (Corrèze);2000;
Lhomme, V.;Le Paléolithique Inférieur;2015;
Lhomme, V.;Tools, space and behaviour in the Lower Palaeolithic, dicoveries at Soucy in the Paris basin;2007;
Lhomme, V., Connet, N., Bémilli, C., Chaussé, C., Beyries, S., Guérin, C.;Essai d'interprétation du site paléolithique inférieur de Soucy 1 (Yonne);2000;
Lhomme, V., Connet, N., Chaussé, C.;Le gisement de Soucy 6 (Yonne) et son industrie lithique dans le contexte des industries à éclats du Paléolithique inférieur en Europe du Nord-Ouest;2003;
Lhomme, V., Connet, N., Chaussé, C., Bémilli, C., Bahain, J.-J., Voinchet, P.;Les sites et les industries lithiques du Paléolithique inférieur, moyen et supérieur de la basse vallée de l'Yonne dans leurs contextes chronostratigraphiques. Bilan de dix ans d'activité archéologique pluridisciplinaire dans le sud-est du Bassin parisien;2004;
Lhomme, V., Connet, N., Chaussé, C., David, F., Guadelli, J.-L.;La gravière des grandes pièces et les sites paléolithiques inférieurs de Soucy (Yonne). Premiers résultats;1996;
Lhomme, V., David, F., Thiébaut, C.;Les industries de la fin du Paléolithique moyen de la grotte du Bison à Arcy-sur-Cure (Yonne);2005;
Lhomme, V., Nicoud, É., Chaussé, C., Coudenneau, A.;Estimation du degré de cohérence d'un ensemble archéologique du Paléolithique moyen récent en contexte fluviatile. L'exemple du niveau D2 du site du Fond-de-Blanchards à Gron (Yonne, France);2010;
Lhomme, V., Nicoud, É., Pagli, M., Coudenneau, A., Rocca, R.;The Lithic Production System of the Middle Paleolithic Settlement of Le Fond des Blanchards at Gron (Yonne, France);2011;
Lhomme, V., Normand, E.;Présentation des galets striés de la couche inférieure du gisement moustérien de" Chez Pourré-Chez Comte"(Corrèze);1993;
Li, F., Bae, C.J., Ramsey, C.B., Chen, F., Gao, X.;Re-dating Zhoukoudian Upper Cave, northern China and its regional significance;2018;
Li, F., Kuhn, S.L., Chen, F., Gao, X.;Intra-assemblage variation in the macro-blade assemblage from the 1963 excavation at Shuidonggou locality 1, northern China, in the context of regional variation;2020;
Li, F., Kuhn, S.L., Chen, F., Wang, Y., Southon, J., Peng, F., Shan, M., Wang, C., Ge, J., Wang, X., Yun, T., Gao, X.;The easternmost Middle Paleolithic (Mousterian) from Jinsitai Cave, North China;2018;
Li, F., Li, Y., Gao, X., Kuhn, S.L., Boëda, E., Olsen, J.W.;A refutation of reported Levallois technology from Guanyindong Cave in south China;2019;
Li, H., Wu, X., Li, S., Huang, W., Liu, W.;Late Pleistocene human skull from Jingchuan, Gansu Province;2010;
Li, W., Zhang, Z., Gu, Y., Lin, Y.;A fauna from Lianhua cave, Dantu, Jiangsu;1982;
Li, X., Liu, G., Wang, F., Qui, S., Cai, L.;Radiocarbon dating of fossil mammal bones from the Upper Cave and New Cave of Zhoukoudian;1985;
Li, X., Zhang, S.;Paleoliths discovered in Ziyang Man Locality B;1984;
Li, Y.H., Wu, M., Peng, S., Zhou, S.;Human tooth fossils and some mammalian remains from Tubo, Liujiang, Guangxi;1984;
Liao, W., Li, J., Li, D., Huang, Z., Luo, Z., Tian, F., Wang, W.;Paleolithic stone artifacts and tektite from the Nalai site at Tianyang County, Guangxi Province [Chinese];2017;
Liberda, J.J., Thompson, J.W., Rink, W.J., Bernaldo de Quiros, F., Jayaraman, R., Selvaretinam, K., Chancellor-Maddison, K., Volterra, V.;ESR dating of tooth enamel in Mousterian layer 20, El Castillo, Spain;2010;
Libois, T., Bodi, G., Nigst, P., Noiret, P.;Mitoc-Malu Galben (Roumanie): Quelques aspects de la technologie lithique gravettienne;2017;
Licent, E., Chardin, T., Black, D.;On a presumably Pleistocene human tooth from the Sjara-Osso-Gol (South eastern Ordos) deposits;2009;
Liivrand, E.;The interglacials of Estonia;1984;
Limondin-Lozouet, N.;Une malacofaune nouvelle du Pléistocène moyen à Soucy (Yonne - France): Biogéographie et Paléoécologie;2001;
Lindly, J.M., Clark, G.A.;A Preliminary Lithic Analysis of the Mousterian Site of Ain Difla (WHS site 634) in the Wadi Ali, West-Central Jordan;2000;
Linstädter, J., Eiwanger, J., Mikdad, A., Weniger, G.-C.;Human occupation of Northwest Africa: A review of Middle Palaeolithic to Epipalaeolithic sites in Morocco;2012;
Liolios, D.;Reflections on the role of bone tools in the definition of the Early Aurignacian;2006;
Lioubin, V., Barychnikov, G.;L'activité de chasse des plus anciens habitants du Caucase (Acheuléen, Moustérien);1984;
Lioubine, V.P.;L'Acheuléen du Caucase;2002;
Lisiecki, L.E., Raymo, M.E.;A Pliocene-Pleistocene stack of 57 globally distributed benthic δ18O records;2005;
Lisitsyn, S.;The late Gravettian of Borshevo 5 in the context of the Kostenki-Borshevo sites (Don basin, Russia);2015;
Lisitsyn, S.;Tretii kul'turnyi sloi na stoyanke Borshchevo 5, svyazannyi s gorizontom vulkanicheskogo pepla [Third cultural layer of Borshchevo 5 related to the horizon of volcanic ash];2006;
Litt, T.;Paläoökologie, Paläobotanik und Stratigraphie des Jungquartärs im nordmitteleuropäischen Tiefland: Unter besonderer Berücksichtigung des Elbe-Saale-Gebietes;1994;
Litt, T.;Pollenanalytische Untersuchungen zur Vegetations-und Klimaentwicklung während des Jungpleistozäns in den Becken von Gröbern und Grabschütz;1990;
Litt, T., Anselmetti, F.S., Baumgarten, H., Beer, J., Cagatay, N., Cukur, D., Damci, E., Glombitza, C., Haug, G., Heumann, G., Kallmeyer, J., Kipfer, R., Krastel, S., Kwiecien, O., Meydan, A.F., Orcen, S., Pickarski, N., Randlett, M.-E., Schmincke, H.-U.S., Carsten J., Sturm, M., Sumita, M., Stockhecke, M., Tomonaga, Y., Vigliotti, L., Wonik, T., Team, t.P.S.;500,000 years of environmental history in Eastern Anatolia: The PALEOVAN Drilling project;2012;
Litt, T., Krastel, S., Sturm, M., Kipfer, R., Örcen, S., Heumann, G., Franz, S.O., Ülgen, U.B., Niessen, F.;'PALEOVAN’, International Continental Scientific Drilling Program (ICDP): site survey results and perspectives;2009;
Liu, C., Su, P., Li, Y., Zhou, X.;Paleomagnetic Study at the Sections of Paleolithic Site in Dingcun;1995;
Liu, D., Gao, X., Liu, E., Pei, S., Chen, F., Zhang, S.;The depositional Environment at Shuidonggou Locality 2 in Northwest China at ∼72–18 kaBP;2012;
Liu, K., Lai, Z.;Chronology of Holocene sediments from the archaeological Salawusu site in the Mu Us Desert in China and its palaeoenvironmental implications;2012;
Liu, W., Jin, C.-Z., Zhang, Y.-Q., Cai, Y.-J., Xing, S., Wu, X.-J., Cheng, H., Edwards, R.L., Pan, W.-S., Qin, D.-G., An, Z.-S., Trinkaus, E., Wu, X.-Z.;Human remains from Zhirendong, South China, and modern human emergence in East Asia;2010;
Liu, W., Martinon-Torres, M., Cai, Y.-j., Xing, S., Tong, H.-w., Pei, S-w., Sier, M.J., Wu, X.-h., Edwards, R.L., Cheng, H., Li, Y.y., Yang, X.-x., de Castro, J.M.B., Wu, X.-j.;The earliest unequivocally modern humans in southern China;2015;
Liu, W., Schepartz, L.A., Xing, S., Miller-Antonio, S., Wu, X., Trinkaus, E., Martinon-Torres, M.;Late Middle Pleistocene hominin teeth from Panxian Dadong, South China;2013;
Liu, W., Wu, X., Pei, S., Wu, X., Norton, C.J.;Huanglong Cave: A Late Pleistocene human fossil site in Hubei Province, China;2010;
Liu, W., Zhang, Y., Wu, X.;Middle Pleistocene human cranium from Tangshan (Nanjing), Southeast China: a new reconstruction and comparisons with Homo erectus from Eurasia and Africa;2005;
Liu, X., Shen, G., Tu, H., Lu, C., Granger, D.E.;Initial 26Al/10Be burial dating of the hominin site Bailong Cave in Hubei Province, central China;2015;
Liu, Y.;The paleoliths newly discovered at the Xigou site, Quwo county, Shanxi province;1986;
Liu, Y., Huang, W.;Human fossil and Paleolithic remains from Jinchuan, Gansu;1984;
Liu, Z.;Sequence of Sediments at Locality 1 in Zhoukoudian and Correlation with Loess Stratigraphy in Northern China and with the Chronology of Deep-Sea Cores;1985;
Locht, J.-L.;"Le Petit Jardin": un site du Paléolithique moyen;2014;
Locht, J.-L.;Bettencourt-Saint-Ouen (Somme). Cinq occupations paléolitiques au début de la dernière glaciation;2002;
Locht, J.-L., Antoine, P., Swinnen, C.;Le gisement paleolithique de Plachy-Buyon (Somme);1995;
Locht, J.-L., Coutard, S., Soressi, M., Kiefer, D., Koehler, H., Debenham, N.;Angé (Loir-et-Cher): un site moustérien à influences multiples;2015;
Locht, J.-L., Swinnen, C., Antoine, P., Révillion, S., Depaepe, P.;Le Gisement Paléolithique Moyen de Bettencourt-Saint-Ouen (Somme);2001;
Lomax, J., Fuchs, M., Preusser, F., Fiebig, M.;Luminescence based loess chronostratigraphy of the Upper Palaeolithic site Krems-Wachtberg, Austria;2014;
Lombard, M.;Direct evidence for the use of ochre in the hafting technology of Middle Stone Age tools from Sibudu Cave;2006;
Lombard, M.;Evidence of hunting and hafting during the Middle Stone Age at Sibidu Cave, KwaZulu-Natal, South Africa: a multianalytical approach;2005;
